{
  "artifact_roots": {
    "finalized_path": ".workflow_artifacts/finalized",
    "memory_path": ".workflow_artifacts/memory",
    "tasks_path": ".workflow_artifacts",
    "workflow_artifacts_path": ".workflow_artifacts"
  },
  "generated_at": "2026-05-13T00:00:00Z",
  "memory": {
    "daily_dir": ".workflow_artifacts/memory/daily",
    "lessons_learned": ".workflow_artifacts/memory/lessons-learned.md",
    "sessions_dir": ".workflow_artifacts/memory/sessions",
    "weekly_dir": ".workflow_artifacts/memory/weekly"
  },
  "project": {
    "name": "minimal-project",
    "root_path": "/Users/ivgo/Library/CloudStorage/GoogleDrive-ivan.gorban@gmail.com/My Drive/Storage/Codex_workflow/quoin/quoin/dev/tests/fixtures/generate_discovery_map/minimal-project",
    "runtime_adapters": []
  },
  "repos": [],
  "schema_version": 1,
  "tasks": {
    "active": [],
    "finalized": []
  }
}
